url,text,answer
https://chroniclingamerica.loc.gov/lccn/sn84026753/1873-01-09/ed-1/seq-6/,of hills rndv o and all toll bridg turnpike y r m d j rie.s or obstructions f ary kind i vrl pense nia ba incurred no da j ail ocul pay based on cb ground c 1 i 3 ere 1 nor for alleged mistakes or mi jayhe isloa a to the degree of s r j i v stroyed ferrie d ont n icd r ocvr ira tiotis causing or increndug dis'irc r j occurring during the contract 1 c fablished after tb m 1v i t r t 1 a also during the cor errn 1 o j v 1 without extra pay the hs u crease i ii didders aro crix'honed to m o t prou sal in time to reach the depart and hour na ej t p rn march m73 j fo bids received after tin stct jnoi hi zi it ia competition wuh 1 l i c re tc ao received in time neuh i can bo c d ered which aro without i i ia r r 11 law and 11 cerdfica'c of tho r r y a a f.i tk ik j to section 4j4b net of j i'd bidders shoild j r strictly according to th i 0 if they dfbire f if the renilar i 1 b 1 th w r r i tised service thi j'her j sicler d j id i i.ero r ii iu j b j in z propo uil con so i 1st i r proposing or sum t.v r t cannot lie eor i o r j ii the route tho j name an i resid of l i usual post offie ad lre:s a d th 1 ct ci 1 member of a firm where a effex should be distinct stated jj j bidders are requested t ft practicable the pi i y.ropr q d the department to oot in lull tho 5 r u heo bid i and to re in rtr.r altered bid that not bo submitted no bid j s brii if i e wifitd w.ihj.ftv.ul of a i uaranror wiii lowed i.lib 4 a j a al isrpct 1 i j touri hou i prev k a tiao fued f r i in iho proposal t i.i i 1 1 muit i nt y two 1 l c ppr t i i i i ce sign l airily with th ige of 1 ps i he l'ostraas r tor a h r reject my b d wi h ii y 1 ot'rr gnut t urid uij t lui'i 1 1 4 t contractors ar.d bidd r i act of j 3 137 section 24j i lb the bid i i i i y f i 4ima:i proposal mat oi u j second as bsfar.t i m rt i r 1 r nt v 1 office an i ont by nml i v y or f i is 4ft 1 000 j accompanied v a certified f f some fo v rit i i a 1 nk e j t p re f of the amount s a v of of j 1372 17 the i o v r t turned f irt tnt f yor 9 f t f i l l 1 nf june 1371 thiswise fta kc5j t r he cqt'iidtrtd k rciny fnii l a i f'r t n i ter oeftrrul man i rt it itr tcirt toitk other pur'izi nrct ir.jl j i i ranifera of contracts or o i n r i e tracts ar j fitbidden jt law at.d con i cannot be a:lowed neither oan j 1 est in bids be ran rre d or a to i purtiea ilidiltri ii therefor l they will be expected to cm wti awarded to litem throj bo wl oai term so section its t v j te provides that mirac a 11 p i the il mi w iwihxl to tl i idi tendetitig auflicient gunra f r i is fortnance w tboat i.e sr of stiolt transportation titan provide f r the d in celerity i nritjr thereof under t h i o i 4 a po e to transport ths ctaii u i ftwtty o i c u j i he ihtonlyu jalllu.arts'f.l.rufl n rt f me entire matt a ii w uirj r it e u the null of conccyanc r jz w j f celerity eermi i'y and j curw j preference oxer au fleet and no t te lidered except 1 jteaiuooa out id i 19 a mod tiaction of bid la r i d jectial toraln i tantamount to a rt j 1 cannot be rtreire i to jar to interfere lar competition tbtvfbf a new 6 i atitee and certificate m tie er y a revioijj bid y j b o tinaat ra are to ba can toeer p to the 3 betati y ofjeuaru ttort witnoai kno j that they are persona of ekscient retpc t.b j in 17 stf _a a e mutt t i sign cert 5enuui.lhia a 4 aid it inurted f b bid ft i gn d b viider n d twoj guatan lurvjar t oj tkk fnifrifc ion by jmill lulqtrt mm to re.h'tc f u otnaltitt n j poetrnafera are a to iav.e to lt tee for acting at ag u of eon e dera with or without com t business matter or tiling rt jl aereice the an the trutiel a q artm nt and cannot c m j capacities 21 ail bidders guarai or distinctly notised that or l i or perform theooatrac i l j for in the accepted i da tier icga i will be eoforcca it i 22 present con at the departmenu mntt cjua.ij procure guarantors and cerub'i eiency subttaut of scribed the it signed h td,"The provided text appears to be corrupted or incorrectly transcribed, making it difficult to discern a coherent narrative or specific details about an incident, including those related to racial violence. There are no clear sections in the extracted text that describe an incident of racial violence or any other specific events. The text mostly appears as a jumbled collection of fragments, lacking clear sentences and context. 

If you have a clearer version of the text or additional details, providing those could help in accurately identifying and quoting relevant sections."
https://chroniclingamerica.loc.gov/lccn/sn84026753/1873-03-06/ed-1/seq-2/,"uotsat failed its conscience by inve tigatiog llepub deans we don't see howr they can disregar j this demand to investigate equally grav cbar s ngaitn l a ilcmucrst bet lug st suff hule ul l u j we do not disjiute mr f'oin r v expls j nation it may be ail t ue we hope.b cau prove ins innocence completely even i i to doing proves yorke and others to b j scoundrels vetroit j'oit i thus it is mr i'orueroy is ihaiged wit bribery by a man who confesses liruseli liar and who is proved to be a perjurer now he is assumed to bo guilts unless h can prove lim elf innocent yorke s no asked to prove his charge true but 1 otnerov i asked to prove it fal e as we said th other day the well known nd humane prm i ciple of law that a man is to be helu innc cent till proved guilty is reversed aod he 1 held guilty till he protet a ujat ce to re quire i'omeroy to prove that he did not brib the scoundrel yorke is mking en unpee biiity what would be tbougbt of the judg wbo should require a man arraigned for fr.rg j ery to prove that the charge was false tiif inauguration a the second inauguration of nctal grant was alien led with the grandest military and chi display ever brheld on sueh an or lion our city was crowded with i ht cc rfrom every section of the union embracing representatives of all the races that laim i citizenship in the united state in the prand procession that escorted tic president to and from the capitol the mlvance the nation has made under the gt i.iui of liberty was epitomised colored cadets from tt'f t point and annapolis inarching side by side witli white cadets col red marshais colored militia colored congressmen all took part in a ceremony in lech only few siiort car a.o none hut nhiu j sorts were allowed to participate n orginiza tion military nor civic withdrew from the line because colored citizens part jp.itej r.o j white person left the iu tugurat n hal 1 cause of the presence of colorwd j tod there seen en to be a general at.pi tu i the new order of things tbe inaugural adjre s of president g tnt i which will i e found in another column w comprehensive and to tiie point ut v t.iii deuce in genera grant is sirciuihen d and ij us tided lit his earnest words on the nutrition of clvtl rights on litis question ulysses s grant right and lis speech will ia a great j measure disarm those who have t.ieu bilteru opposed to liiu because of las seeming tn lit i ferenee to tite great question atl'ecting ti:e t colore citizens ot this country these are i the words of the president the cifecw ot the into civil it.te have been to free the slave and make fcim a citizen vet he is not p ssessed of the civil r glits i which citizenship should carry with it this i is wrong and should ba corrected so tar as xecutive intluence can avail social equality is not a subject to oo legislated upon nor shall i ask that anything be done to advance the social status of the colored man except to give him a tair chance to develop what there is good in him give him 1 access to schools and when he travels let i him fuel assured that his conduct will regulate the treatment and fair lie will receive there can he no doubt of the earnestness of the president in this matter of civil right then let us hope that he has sounded i key note of success in the achievement ur protection in civil rights as he did four year ago in ills inaugural address when lie advocatcd the ratification of the fifteenth amendment the president is ready to accord full citizenship to the colored people hut tinwork is to bo performed by the law i.l iking power to congress then v turn roniphttfrcehm general grant will be the i president for all classes will uongrc be the iqaker of just laws for all class j i'rolretlon l lining tlio retnaihable growth of our ruanufac tur uu establishments since the policy of prote bin 1 our industry was revived nt the beginning of the war ought forever to close the mouths offree trade demagogues and it would wen i not their personal interests best promoted 1 by the anti american policy they so clamor 1 ously support facts taken frotn the last census report show that iu no period of our history has this branch of industry increased at so rapid a rate as since 13g0 notwithstanding the rebellion according to these statistics there were at that time iu the united states 1 in 113 manufacturing establishments of ail descriptions in 1370 the number had grown t u 1 2s2,148 or nearly doubled at the former date the whole number employed was 1 r 311,246 while in 1870 the whole number of hands was 2,033,988 a proportion of increase 1 slightly less than at the beginning of the 1 decade showing the average number employed in each establishment to have some j what increased the annual cost of labor in 180 was 378,878,906 un average of1 8283.94 to every person employed iu h7o the whole amount paid in wages was j773 j 1 o21 y93 giving an average of 3372 hi toeach 1 i of the 2,033,933 employes this show s an average increase of 93.71 in the annual j pay of each operative it being understood that this atl'ords no criterion of the amount i paid to workingmeu and women because in ti o census returns boys and giils whose compensation is often nominal rank with 1 j full hands let us look still further in laguthe total i i value of all manufactures produced in this country was 92,244,801,219 aomothingmore i i than the present amount of the national eht jn 1870 the aggregate amount was 44,2 2.025,892 an increase of very nearly t one hundred per cent from the same table it appears that the amount of capital invested in manufacturing enterprises has about dou bled in the decade we are considering these are figures which it u well for the j opponents of protection to ponder carefully t none can deny that they have added the t largest share to the material wealth of the 1 country and furnished work at good wages to thousands upon thousands who now enjoy comfortable home in consequence 11v.v 1 i could this ha o been brought about had our j s markets beeu throwu open to the pau r labor produc ts of the ol 1 world tj as an oii et to this england bought of i other nation 4283,000,000 worth of cotton but a trifle over one halt of which was from j the united states against five six tin or 41 j pounds to every 17 from other countries be fore the war the value cf bread studs i bough of all other nations during the same j year amounted to 4235,000 cs v bet about 1 t hail of which was from us y j s tin t'r eiinitn's sat ings llank j this lnslitutl ju has already dune a noble work he uneducated among cur people have to some extent learned through it the nature of ciedit and the value of forethought in securing credit every deposit ma 1 in the bank has a tendency to cement the dejiosij tor's interest more tlnuly to the huollty where it is made or else it develops in gn tu.strenglh his sense of independence of these who would tie him 1t a locality egaiu t his will uealising the importance of his copartnership with h k race in the plan of sav j ng by which it r u one day bei.ioe the j owi er of ll ueh the southern snl and uiit derotunding the rw r which accumulated means will give him in the way of preferment b arid imalulne l.e ii e above the habit a 1 custom sud feeling which cliaracterlze the majority of hi brethreu and become ait e iiuptiug example to tbem the educational t inluettcw thus derived have a utriklngly proi gresetve effect upon our whole people b llut thu u oot the higheit of the achiever menu of the freedmen's having hank it has very largely utilized the native talent a the educational ability and integrity among j colored men when the young man of e j character and qualification ha felt lha oral cold daab of rapeuant influence a ha append a to lha banlt or coubung houwi kept by lha richer rasa our bank ha flung it door opan to hint and offered him the mean of a bull ejaatio r l hop 9 tad ispirati n the nwl for mich ur t u cannot nt thi me t c ov mtinnted wc need it every i rr nr i el.v.u the forethought of the rr i tt ii j s r on tin ttcd river who u r i.rvv t njr r lrr:u the tasking if mi iint gets n:re r to ren to him he n 1 m.itemci.t of t e week that m in i ira what the pfat ot it u it u ii ii lunri n i m c la.nier out i ii i i i irtibine t i.tician who i hp wicb's tli s 1 r j'ct ten nothing to do with tl s of rnsk 114 up tho nomination at a u h limn ummtth ichor bat i 1 tool lown to jo good business it t fact tb si ho colors j m w ho tana ait ntioa trommorcp wcks in tin to icutmle evou tho on tsars sacrd i i u i c mir.on and why simply i uck f kmiin ii t.ut or oi hu ii:c v u:o prv vent hi.a tiooi k liio'i i j bn iiii i iiiutr is nnii whoae tr colored men have the o i r the tact m in the case r siojdu u h r w dietz svhor er they h.ive t j t.ctl us.t and curs necessary a i the c i o of jo i'inclback an 1 i dunn u he c iv they atone for ii unpepui lor by iar methods t o lis it si ru lli ti 1 te v 2mui j 1 i i i helpir largely w njs r r.n u ufbc.oct number of our people c u.r.ier ai k that may 1 available i in i who have bail none lieret the bank a aiding in the devci meat o business power us well rs i promotion of business knowlosli 1 r.n3 n r v understand nnd w k ur o uat t is litmttt.tn nittct tirmthcrn it altera bj m loans on un loubted scour:iy i'crl.ap up to this time a.etc re i some stubbornness in nganl to such a cort raodnti sns but at present w s i no rcaj why ample collateral houlj riot ccmusai assistance for thos i whose monay so largely make up the sum total f depi iti a the bank for ttglld th i bat k as om of our i greatest educators i'iip court nt claims on iava i 1 i i ian ifft i s vs 4 our conviction that th court of claim should citl.c r e abolish or s pos r vet greatly redmcd as it no organ oi l tc seom to potest the j is well aitu disposition to approve all u claim to damages during the rebellion i.pt iaji coma under an absolute constitutional prohibiti n from rebel no from loyal applicants","The text does not contain any explicit description of a racial violence incident. The content primarily discusses political themes, civil rights, and events surrounding a presidential inauguration. There is no mention or quote related to a specific incident of racial violence within the provided text."
https://chroniclingamerica.loc.gov/lccn/sn84026753/1873-04-17/ed-1/seq-1/,"the new national bra and citizen prsushrn every thursday morning at wmklapu city d c tl tbs kw national lra asdcrmr cohrabt i i.kwis h douglass richard t greener j ki.itobs john ii cook j sella martin corresponding editor jt i i'm r si hfiiptinvl intfu f j co r r f f t lfl in k kf.nk.kic k imi'bl.am jr i nr tirj j l bot31 wmmi lm n.c i t commukica 770a s f i rm xtw sfinoiu not h f r f ipr mm 1 y c rr n i nt w ll rit ni jmdiunktti iu ill b mi mfittd a i.i:tti:r mini oino j cincinnati april 12lh 1 73 j jf t the editors af ott a etc national era vanity of vanities nitli tl e preaeher i ill i vanity yea verily and vexation j 7 spirit ktliiojiia stretehed forth her hands s onto the l ino of republican rounder yclep i tl a convention and the cry of distress was j i l oiided to l y the nomination of one of the s n if hani nevertheless the fact that he was a man and brother had not settle 1 into mm ietion in the minds of a major ily of voters the liandwri in on the wall j t i e ballots did not contain hi name often j id to make hi election sure thon h h he i loti.lly valldl there is sfc we j in ailin ilul hashing of tot ill lly of teeth the whang 1 i ii tilit 1 h r il first born nnj like tri l ti r ki hi tie black hut comely i ii i iii eu refuseth l he comforted lit i'olili iri mi.i ei t catch the unwary it lilt t all i which means to i a.v that l'eter ii i m in u i not hoscu t represent us ill the j hi t t.iulh n il invention il is more our pi misfortune licit his there arc many ijucs la t is t i r.ri iii that body alfceting our in fir let i ittiil he was the man of all others to li sec ami understand tin hearing they would fri hate ii ii ic as citizens of the state in over the liliine our german wards th mr i laik was subject to much scratching on a acc iutl i i hrwig thought a preacher t tier an man pane having designated ltiin as such dt and mi this e lie was scratched for i la in a j i her a depositor in mr p i'ltaioah i t this uhi s:twiug with hi a vengeance tn mr l ii sjal hit he is satisfied in having demonstrated i the republican party nc that a eoh.ti d nominee does not weaken the on ticket yt i i hardly think another colored an man in the c unuuiiity could have pnlledany hi things lain a vole i'ourteen thousand ri 111 votes is an indication of some ad strength in a city where less than two thous re ami d are colored however the lie w publicans are jubilant over the tact thai they j ullcil down the liberal and eiin cratic i en majority of november from 0oo to less than eli j n i and are confident of winning next l an time the colored voters begin to kick in of the traces and ere long there will be many j outside of the kcpublicnn ranks vc lly the way 1 presume that on the priuci j l t pie generally followed of giving oilice to retired congressmen or defeated candidates j lb mr clark has won bis commission the bit only place apparently hiving around loose in i to this vicinity seemed to be tbo l'ost otlice p there is assurance that no chief clerk i would have to run the otlice for more than l tbo fir t week anyhow under him j y the j mocratir papers spoke in great j fi praiso of mr clark both before and after i the election and many voters of that faith agavc him their suffrage u t obucd men appreciate the courtesy shown rc their candidate by the opjsisition press and th one only nerds to go among them to loam its ctlect tli the following from the krminy slnr of the a klb needs no comiuent iie colored vote fri the independence and care exhibited by ur many of our colored citizens in making up pc their ticket rive assurance of what we inav r expect iii a lew years heretofore they have m been treated as mere tools to lie used by uti m rupulous politicians as a matter of course 1,1 the day is last column if it lias not already j tli that a low lic uldieati hummer can liave the tli cheek to thrust a ticket under the nose of every colored man approaching the polls and say with brazen impudeme hero's 1 your ticket m the fate of 1 cter ii t lark whose ability of ami worth should have commanded the votes at least of every republican will he a lesson not soon forgotten we know of many detn le ocrats and l.iberals who scratched their tickets to his advantage and yet with this out la side aid he runs behind m this is a fruitful subject for reflection and we think evert reflection colored man will reflect upon it of a recent change in our municipal code r by the la gislature provides a system of 1 mt:tt:oi'ot.ita foi.it i i in charge of four commissioners ami the d mayor tr the mayor and three of j the owmtmn are 111 mm i 11 and as nearly all the force nmlt r the late adminis i j tration are uejiuhlieans they in the words of a iermati papi r look sadlv toward the dav is when the new hoard t ommissioners will i j take the scepter in their hands and w ill allow the damocles sword of dismissal to hangover the heads of onr honest blue coats the blessings of the police hill the irish club police is not a very desirable or pleasant compensation for the dismissal of our present excellent corps in which there is about twenty colored men we have reason t i know the full tueaniug of the term irish i luh jiolice and we are well aware of the import am to u of good policemen incin j j uati has enjoyed the protection afforded by v cfliciclit guardians so long that days of riot r ing and bloodshed cannot i e i oh rntrd undi r any circumstances i in the tint of tlie irish club ailice i j the i t wjicncrcr a crowd of roughs dc j j sired to have funic fun they would clean out a colored church meeting and us we are so j very religious i we could always accom j mo late them by having one in session ir a tiiend of iniiio once went to mayor s allin and asked protection for his people w who had been greatly complained of for rc i sisting one of the usual attacks in exten jjj nation of his friends he related that they j had called upon the police hut were refused a protection the mayor thought ni gcrs had no right to light white men anyhow g0 in the name of god mr mayor w hat theu w are we to do said my friend why re ai plied he run damn you run however i think there need ik iio apprehensions on p that score at the present time and we j needn't borrow trouble by anticipating it i hlv j it iiaun i wi ot the i'uiou baptist church of this city to liatdcd mi yesterday the prosj ectus of a ie new hook in has in press that will he issued i i at an early day eutitled pu ne vol iv no 15 tin nlv iit of alfl.lftios anr tl jwhmwi ii recovery it seems to be the story of hi life wht ppears to have embraceil many trials tro ilee and tribulations elder magec stat bat be was induced to write the work by tl act that among the til ok colored baplis f this country not a single writer lias y ppoarcd as be lias been engaged upon r six years it ought to be well w ritten ai blc lie lias enjoyed unusual advantage f travel and study was a student in spu eon's college and at one time took the pri ira i atin thesis having listened to biin in aire i hardly feel myself justified in forn ig an opinion of his ability but i can be niiiihuiv m me excellence 01 ins mcin n nnon upon j.incoln delivered last april ic request of the memorial club deru ir i ier from mississippi jackson mips april 0 is7 i lie y titers nf the rtc xatinnal era ftrtnflssl i closed my porsotmrls of 01 egislature thinking that i had sent veil ctch of hon j ii mokmax washington county ilut upon rcceirin air paper to day i see no mention of bin am almost sure that 1 wrote it hut ma ive forgotten to enclose it with the other needs no sketch of mine however to ad the already prominent standing of mi organ as lie is looked upon as a man in th ghest pense of the term lie is a larc nperty holder in his county cultivates rge plantation in cotton and corn and is st class example of what the changed cor tion really is of a man in slavery to one i fedom lie has no further object in con g to tin legislature than to legislate f ic benefit of his constituents of his count id the state and it is really a pecuniar orifice for him to be absent from his p.lac iring the session of the legislature lie is believe a native of this state was a tinted a member of the hoard of supervise i ion ames was elected to the i.egisb rc in 18cj re elected in 1s71 and lik nator gray of his county will lie rc elcctc xt fall if he wishes to he exhibits ahou le fourlli indian blood in appearance la id slender in form and very aristocratic i s general deportment xo one can be in aduced to him without becoming an earner imircr of biin and it is indeed a proui collection of mine that he is on my list o irm friends long may friend morgan liv do honor to good old washington and t ntinue to shotv to those haters of negr evation that all we desire is a fair chancel we cau rise in every respect to the levc common humanity 1 notice that you compliment en iran ry highly for appointing colored men t sitions of honor and emolument in tli ale of georgia 1 lease remember tha ere are other states in which the 1 resideii is shown the same recognition of our claim high olliees in this state he lias aj inted our warm friend iios robert h wood tlie position of postmaster of the city atclicz mr wood was appointed une t c justices of the peace of his county b en ames in 1808 was elected mayor ateliez in 1870 and retained the positio itil last winter when through the con mptiblc combination of certain parties v it e democrats lie was defeated by a sum ajority for re election ilis claims lipoi e party were strong and lie was loo goo man to be defeated by such a combination nd all of our state officers as well as hi end hon john ii lynch m dec lited in a","The section of the text that describes an incident of racial violence is:

""In the time of the Irish club police whenever a crowd of roughs desired to have some fun, they would clean out a colored church meeting and as we are so very religious, we could always accommodate them by having one in session. A friend of mine once went to mayor asking protection for his people who had been greatly complained of for resisting one of the usual attacks. In extenuation of his friends he related that they had called upon the police but were refused protection. The mayor thought 'negroes had no right to fight white men anyhow.' 'In the name of God, Mr. Mayor, what then are we to do?' said my friend, 'Run damn you, run.' However, I think there need be no apprehensions on that score at the present time and we needn't borrow trouble by anticipating it."" 

This passage illustrates a vivid instance of how groups of roughs would specifically target African-American religious gatherings to incite violence, the refusal of the local police to intervene, and the apathetic and discriminatory response from the mayor when protection was sought."
