url,text,answer
https://chroniclingamerica.loc.gov/lccn/sn84026753/1873-03-06/ed-1/seq-3/,"1 bri ill drove the inmates of the house from the tei remises the screams of tha woman aroused of toekard who want to the ecene of outrage els nd upon remonstrating with tha crowd be pl ras told he would be ullad if bo interfered r rlth them other outrages of a e'mllar character to bese have been committed in aiauancc tbi ounty during the iastmnnth to prove that ro ic e outrage rctuaiiv t'jok i i bm bly to th.it i have ccn the superi w our cleric cf a1 r ce county who in n s me that the super or court was in es q in that c ur.ty and that true bills i abetment were unu by the grand juri riin t the pa ties w tabbed ltn f 11 an nrsgc i the v rrtn or m vkar m sack i the f u.it of t o a a.c of tin it through the s n tr v y rm i lur 1 i o e u'c cannot perccivo the justice in tl reoaehes heaped u n the colored ple by en vr.it ejitois relative to llieir igti ice anj stupid.ty when if they are lab a n der either tbo'ono or tba if r of thc e eictions it is not r m nny tie ae f tin it 10 hut i rather the legitimate fruit of li rlas 1 c edition of servitude from i i y have but r entiy been liberated wi lieu that every candid reader will r r itir us that the intense anxiety of the blacks cultivate licit riiiiid and t acquah.t eiuselves fully and intel p yn tin iv duties which f.icd ni requites at tl.cii iu is is so great aud per b tiu that the 0 always ready ta mako any sacitii.vs or ulento any priv.iti n to remove that ch ud ignorance under wbi h thev were envel icd in slavery the ruan who r.tt n t to iko th.o colored pe pie act tho part of slaves en they have tact i the sweets c t in e or will un ortake a task which must bring in to an ign iniiuous failuro to cscn i tin 1 11 ia nf kn nei.wll v r 1 discs ii.ii ut j a wholesale abuse f the 1 5 titersbut upon the other hand ho who reguizcs liio rights the blacks who treat em with that consideration to which every nest citizeu is entitled will not ouly tluii t intercourse w th them pleasant t.tid i t clo nt he will ills bear willing testimony the fact that a3 a race they aro making rid 1r gre s towar 1 mora and intei c tna provement negro worshipers is tiie itlitt contemptuously applied to the he cans of mississij pi by that class of small ins who have tailed tu till their efforts drive tin c l're 1 voters to the p ills and tre tu he then vote is suited their aldsh rposcs i he charge is br cd solely u on fact that our party 1 is used it's past arts and u still faith ally laboring to m st colored people along that to thorn new 1 uutried highway which leads to at i nlitened exercise of tins privi.cges of lieou.atni to lite eu.j iyxcut of the substantial uforla and blessings of life republican lihip of the colored race therefore conts in an ironost and sincere desitc to make vortl.y the name cf american il ifoirhip vortdrip by the way which u not c t ne i the blacks alone lut embraces within its sail r nd charitable inlluenc the pa ie of sry nation md every clime wb icek a use under the america a ilag it f inns a rt cf tlio weekly work of aim t every luoctatic editor in tl o it etc to r t eat the i stereotyped assertion that wc the ithcru people are llic best friends of the icksbut it that f icndsliip consists in iroaching them for tiie iguoraucc and ipidity wlrieli was entailed upon them by i whites or in denouuc ing and vil.iying 1 t men who are houestiy engaged in labor for their welfare the colored people may it and fcrveutly pray to bo delivered from iir friends but ivo believe that tlio men io are so fond of denouncing the blacks as orant and worthless will yc live to cat iir w a i acknowledge their great eng e nave watched tlio colored peonarrowly wo havo closely studied their iir.atious and characteristics as developed icr the changed rolatioua ihey occupy toid their cotumon country and wo l'eel no iitaacy or doubt ia declaring that they are ate of peopie that will prove a thousandit more valuable to the state as freemen in they ever were as slaves strictly atitlvo to their own affairs eager to educate sir children singularly attached to their irthes and faithful in tlio discharge of sir religious duties and as industrious and galas the whites who shall deny to the cks an important place and a leading in nce in tiro luturo of the rotate it in ul the k iiiiih newspaper vuthorilies lavo dilfered widely as to the lion and city eutitied to the honor of hav started the first printed newspaper for uy years it was supposed that tlio credit onged to england it was claimed that i british museum had a copy of tire earit paper in its collection it was called i english merevrie and printed july 23 18 hut it has been shown that this copy e specimens of rare old coins was spurti and gotten up for sale watts the illographcr of the museum who saw on r ruination that the type and paper were modern origin and did uot belong to the tecnth century exposed the forgery ft s an ingenious fabrication pretending to 0 the ne ws of ibe spanish armada w hich s destroyed in the english channel by i ake and lloward a day or two previous to 1 date of the sheet there were covin mhers of this spurious mercnrie produced ir in manuscript and throe in print venice has also claimed the honor of icad the way in giving newspapers to the rid the oata ua thus named because it d for a small piece of money called j it is asserted was printed there in 1170 d it is pretended that copies of this paper that date are in ouo or two collections in ud'ju but late discoveries have appaitly established the claim of the old ier.u city of nuremberg to this high honor paper calle i the utuhmt according to truatrtby authorities was priuted in that city early as 1457 five yeais nfler i'cler l uur cast the first metal type iu matrices ire i a berg with the first paper iu the flfinth century also claims the honor of the it paper iu the sixteenth century there aa anciently printed sheet in the libri coi.tiou which antedates all others except the set or 14o7 and the chronic of cologne is called tlie neat z uiwj aus u ipuniw 1 italian nu 1 hea s the dato of february 4 tho liriush museum it is said has a plicate of this sheet i'bus to germany belongs the honor not ly of the flist printers aud the first prin tr hut also of the ci x printed newspaper has also another claim of distinction in 15 egenolf liurmcl started l t 1 runkfurur erpcmtamts zottmj the first daily paper in i world this j.oiiialis slid yohlisired d the city of r.aurfjrt fs to erect a menunl in honor its founder and editor as t father c i e vspapers from 2fo vs a aud editors by a conant in liarr's jiogamne for march mate are few names that will bereinemred rith mots iutc iest uy those who took it a the r for tl.o union than that ol iv geary whose ttii occur.od on salu i y he represented iu ism rwable degree j s heroic spirit i me bleb wm ricn iu roes he was not only a brave soldier i ding to perform faithfully ail a soldier's j tlcuil dutt.s but i v i uougbly in e willi lb a boij i work tbo excitants and dangers ti.j achievements and i uors ol acliru sorvl.o j o ssed a iua u ruction r him moreover be found la trying portions command i v bleb bo a called lull em lament tor ability of co usually high or r it was bis f tune to ta aii la itwoim iblasad j xestful gem ms of the war be was gettysburg rad j u ut m nut iln la ibo uudrc 1 d y i c4 i g t lul oi alias i and iu sherman's march to lha sea and lighting ad v rue t r ugh the carolines i all he dtstiogushed himself ilia political xer also was characteristic of l o times which be lived lie was originally a dern at aad felt for bis party au attachment licb many restless young meu shared rut tea be bad gained position tu the party i d was sent as governor to kansas bis na 1 e sense of justice revolted against lbs pro.very rule and he opposed ii with great srage and firmness lie was from the outtak of the war heartily loval and was of j the war lu full sympathy with the alms the republican party lie belonged to a i taa of public meu of seal worth au j great lrtt which is gradually pajjxg away v fan ptl l m t there are 11,000 men on lha pay rail of lake hhore and ylatlgen soeinsju rahkd 1 i tl i'tlft in view of iho fact that wo r o co n to hnte postal cordo we take j lcasuro n i il li i ng the following article in tr nrj t tholr use in tarlius countr ft cf ear q it wiil impir re par period aft wo atp ftorri to have poitnl ctrl a w on their n e in f ur r a will n t be without interest mr v w ki the irn tb bak of franco in timm vw object with it eat dotal u a recent an i 11 i i c n u o i r card f r tho urj oj insults g or slandering one's uelgv rs is csudnod to englan whether this irises out of anv peculiar'v t m n turo of englishmen or tiiglislw n en wl ch tm e'a theui to mail themsolvrs of the op r.ue y forded them f r disseminating s i e v.s ire not nifrme tho fact how rer i that in germany insult nml shit or its caids are uot cut tl.r ugh tl u im ikntieh tal em j hair been in u c f u ii l fa t cotutiod to h li.o eetcre nurul of tho gem it veft.t lie u s n i l o th g e u ee mn.itiii ii tliau th ling w t i tlined to tuit.jc the t v v n that f ie:guor as tl a fii i.e on e t o tho lives on tho c tit uc t 1 j e e addicted to tatti 1.3 nr i.l 1 u s sip than our english rou r it i 1 1 1 pod american will follow t r.tal an 1 not tho english ex it ti t f and wo nro luciined to tl k th v w.u i cbtors who arr exasj or n selling thoir small account 1 y vi a ineel to reminders from th r etc i.t in the slmpo of postal car l lit y ur tea c.ive hardened","The provided text describes incidents of racial violence. Here's the relevant excerpt:

""1 bri ill drove the inmates of the house from the tei remises the screams of tha woman aroused of toekard who want to the ecene of outrage els nd upon remonstrating with tha crowd be pl ras told he would be ullad if bo interfered r rlth them other outrages of a e'mllar character to bese have been committed in aiauancc tbi ounty during the iastmnnth.""

This passage pertains to a scene where individuals (presumably a violent crowd) drove the inmates of a house out, and threats were issued to those who attempted to stop the violence. Other similar events are mentioned as having occurred in the same county over the last month."
https://chroniclingamerica.loc.gov/lccn/sn84026753/1873-01-16/ed-1/seq-1/,"thin receipt n butlci eye fell on it whereii oii ien kulbi huiiiei a peculiar mile member dterw ard int i to know what he em to mile at and butler 11 report d an v.ivin that lie not d that there wan no internal i one that leeeipt a fact which bad ij i'm notice of the othernow thai tie n the teeeipt lilllht hn e been if if f since the abolition of the imp t i s a i the receipt pretends to be a d ctinn n given several years igo mi m ftiflm v hei stamps were required on all u b r ij i i it was really given recently then it fi ow as a matter of strong ion that mr brooks'son n l.iw is pla in a i ri congrei in whuh he forgot tie inp new or else mr brooks son ti l a ti.edto cheat the jovernment out a tamp tn his receipt is of no value if the report true however a time is cofmn v.hen to o butler will make things ur 1 i n mr brook jmio.t i'osf advwat a of free tra in there any mich left should not f i t an and study the fezim pre nt d by the ir trade of the wr t a pr t live t irut u r u has been the gpecial nv m n of the fr l a congressmen from the western mat w in the j ast never tired o t t n if ricultural resources of that great and pr perous section of our c m n eountrv t under ii o tm ueii vui mnwnt v r u v iivfc tariff several of tb t luni iiwealth have tur c i llurir attention t it j ro luctioii of iron uu l in the 1 ohio turned ut fnmt tht ore iron chr a ue of us in hnn illinois un 4 i mi hiifiii f 1 1 o7w47 2il 2c with thi jjratifiaii ami i riiu amo of tijfure ut r twin w.ii the in trsub men of the h'e l ttiivc t u ri try t of the heat i iurc ti t th ir t lituino f the bene lit of ku h h manufa twrei i the kmpreitof ao tri i jn n innuall 50,0 10 florin for her wardrobe","The provided text is unclear and disjointed, and it doesn't appear to contain a coherent passage describing an incident of racial violence. The text mostly seems to discuss financial and governmental issues, mentioning topics like receipts, taxes, and trade policies. There's no clear mention or description of any racial violence incidents in the provided text. If you have another document or need further information analyzed, please provide the text, and I will help examine it for the requested information."
https://chroniclingamerica.loc.gov/lccn/sn84026753/1873-01-30/ed-1/seq-4/,ami h mvo a l:n i i ontioti i i n'r w xat t i i 1 irame isitor t r tin l u tie tin i uni v carin i v appi a i t our i n i vhero to aid its l their i j t ami 11 r ntluenee tin fii iiptioit prie i'i xi a v will 1 e ai i t i r copies f r h in advan a m l cmmlimck lass i u i i a i i i h t 3ur premiums to i:iy ft uiliii n ti'i r ft i tlir oil tl our ui.scription r:i ft 1 lorwitnl k r i x111 piviniiitin i u mrt nilli t ollowintf a'llt m i'i i i iii 1 si ir ook isojt i wu liiiiklon i on or i ii rilu i i s i w.itcli v'io 111 i i ril i m in vu li i il iv 20 rulim ii m i i si i t all ii ill oil 1 r i lil.i i lv i l i i i i iii.u o r o u ilu ri 1 2 ill i.i i ri.i'i ii i i m ri:i:i stci i m.i a a im president gliasfft for two milimtihors v ith tl n v v.e ii semi tu ci'pir.i ot tis p o 1 1 111 111c i u ii rii r i i t li.m's splo liil stoel i ir ingot i'i l lit irai.t l y mail po tp ml r j m a roller i in ngraving tin i loll ir am tin inij i r j cash premiums l or ten ir ul.r i i t will t'i uh r 1111111 i of s r jtl vi ii 1 rrilife s i in 1 h vo.irlv tili il periodical premiums we trrr for on mb niwr en ling o of th n'l.kv nation u i n i it r l thr following j i i j l intn aijriruuvri.it i r p j i o ithlyt containing it lartv i he farm garden ami how ion pri of winch alon i i r i m iithlij fail i n imnth.s 1 he nil i r i t i 11 pri or the f th i or out jri iir full of good re i.ng ot he late war and oni f the f:j irif.n in the country in addition to the al ov e r li w m n r v r hm i it it rrk i he ri j i ii pro h i11 alone t per r j p 1 uo new h i u i i a'lon i atr i i wf v 1 sel i i f'kj'l r d the n v n v ion m ndine it i.ve siibkf tifplion fiirf o i ft iv rr ttl iotut t i'ft i pa f i r 1 f i i i ii i i r r li mil ir i o oo ifit lo i ft jo oil o i o oii dm r t 1 i t r l j r m y at i i i r f t t 1 1 l t i r r l.nft i fc.r rrtfmt.vu i nckihk u illll i brz i wi i agents lor th i iv national era lit m ihl t n i s r vr h ti l iitsr n i a 4 n h ti iv.i t roh k r i in w 1 h i i 1 v 1 j win km iii v i j i kit ii mil m r x j ir i in it r w m j hakklni l r ijv 1 j'ill n o nn t j t wood h l jii i w v 71 knkk u 1iiii k a i v ii 7iikkkt l r am ii un k y i hill m i i t m j n t i j h4kkikk 1 n m m'i vnl llktt 1 hankv a i l i n atii ki'm k.i i s ii f f u a i i k j li j i i n i'll if n iii tkk 11 vrtl c r j iami hi au.i i lltu ii mitllir.l.l 1 1 i m i a 5111 ii i v lilki k ai.am k m a ii uriun 1 mm y m llkl husky ci.iv 1 i k a i r rr.i mas i v mill if lllll'illv i in j i iii k hkkk 411.1 i.l ful mm i jihi ik i i i k i iiiu ill ii 1 i mai.ilk alakk 3k anrl ti i m m o vaxck k k v i,"The provided text appears to be significantly corrupted or scrambled with missing characters and fragmented word parts, making it incoherent and unreadable. Due to this distortion, it's impossible to clearly identify or quote any sections describing an incident of racial violence or any other specific events from the text as it stands. If you have a clearer version or a different excerpt that you can provide, I would be able to assist better in analyzing the content for your request."
https://chroniclingamerica.loc.gov/lccn/sn84026753/1873-03-06/ed-1/seq-3/,impoiuuious dal.fr w t'l 1 1 t fc 1 any great annoyance in knowing that tl 0 post otli o cleiks nnd car 1 1 who as we'll iware of tho state 0 his hank nccouut is i 3 was hiiusolf oil th.o ct hand peonlo who aro usually prompt in ft tug ti.u 1 inli'htudni'ss 1 not he a t t i shed if they should lap pea to l lc arrottv tilo instill ciu'l will l.lsl t 11 cod ia austria whero it scon s t hi 10 been invented the 1st of october h v liio llrst yew eight miuloti postal caids wuro sol 1 lh i ce being two kreuucr 01 tivo centimes in l toit was introduce ia germany an i v successful that its nileo has been reduced oue haif troni eigl l to i.cn thousand eirculato in merlin daily tl.u numhor b n exclusively 1 eal cards that aro not received from nor sent hoyoud thu lity limits lata in 1 70 tin card was ititrndueod in eujlan i the cost being a half pcauy tho thst yeug iii ore than seventy flee millions woro used and in 1472 a number still larger i11 lsttj the number of oxdiuary leltci transmitted wi w vn nu uunu.a avosng increase of correspondence dining the fir veai preceding was feur ixrernt iu 1 7 there were ii.lvo.ooo ordinary lctlois carried by tho english mail tin uurjnse of im i r cent over l.s7 j swllzetlau i introduce the postal cards october 1st 1 70 at 1 centime each darin the next i ir thera w em uearly u inillinn an i three rtors u ld while ordinary correspondence iuci eased nlmost teu per cent instead ol seven which has been tl.o regular rale of inecaac previously phis is n sutllcicnt proof tl t apart iroui the k'iiu to the post o livc department by the use of cards they also ten 1 to iu tucrease instead of a diminution in the number of letters out delgium iut educed ill postal card in 1371 at 0 centimes ami ivlilln it lias beeu highly sucec3 ul the amouul of ordinary correspondence increased mure iu 137 1 over 1371 than in u71 over lrlo holland charges 1 ceullincs nov fay 14 entimes sweden id centimes dcu.u is ecutimes kussia 20 centimes italy and p'r net have sanctioned the issue of cards but ha not decided whether to chargo ten coul iuoa or live hie system is iu onerntiou hi spalu 1 ortu al and uieeee but ins not been ufliclently hied to announce the remits turkey is the only country in kurope vvl eie the postal card lias uot yet ijeeu introduced tliu ligurc we liavo given from mr wolowsui's interesting article warrant the belief tii il tbe postal card system will ho succossfuldn the l'nilup mates and hch.i to dcrioas the delii t iu tho p'ost ollico deparunent when tho department pays its oxpeua s vro may perhaps begin to think seriously ot cd gitiuga postal 1stegrnph system the true m ry f in lust t c grain the bill mat with neither snoerr nor opposition iu the senate but the business ot iliut house went on vrilh discouraging slowness at twilight on the last evening ot these siou march d lalbj there were lib bills before n 11 beomeii impoasibi i tor ll i j lreached lu regular course bcf.io t i.i hour ot adjournment ehould arrive tin i'rofessor who hud uuxioitsly watched the lardy move inuuts of business ull day irom tin gilic y ol lu the zonule chamber went with u sail heart to his hot 1 mi l nreparou to leave in york at an early lour thu tint morutug while ut breakfast u servant lu tunned hiiu that a young lady de lre l to sue hitu ut the parlor there he met miss annie ellsworth thea a young sshool girl ti.e daughter ol his lu lauute lrioud iloii henry l ellsworth tho i'irst commissioner f patents who said as she cxtouded her haul to tnui 1 havs uome to cougratulute you upou vvhatr lequued the professor upou thu passage of your tail she re idled impossible its fats was sealed at dusk latl evening you iauetboinistal.cn not ul nil the responded father scut lue to lull you that your bill w is ed he reuiaiued until the cssioa elo ed an i yours was the last bill but one neted upon and it was passed just uvu iniuules bel'oro thu adjournment and i rim o gl.iltibothc tlret one to tell you moth r says too that you must come home with i to creakiest the invitation was readilj ptud nn'l the joy u the household vv uudenuded iiotlt mr aud mrs ellsworth ha t lolly i e lieved in the project and the i urner lu hls coolideuce m it aud lu his wanu iiend hl for professor morse had xn.t a tl.a closing hours ot the session lu ti.e be tu chamber doing what he could tr hel the bill i juj iu.u s u w cl ul blah pei iouul and ollltial piji.ll u uraepiug the haul of his jouag friend the profesaor hanked lor agaru and ngilu lor bearing h.m tudi pleasant l.i 1 i u eurud hit that lint ahouu ee uor.rt j vlme the tttst inesiage 4 her toward 1 r a in it u v a talked m lu the family aui mr worth aujjgwtud a n.esi hu l'i r a or mrse twwred to lire 0 rughtcr thr her upproitl i and thu a the uiwl vaa suaearnestly sent a little mora than yenr aflur il.r.t u:ao the lino betweca waallngl i nuj jihtl uru vr.a completed profos jt m as in tl fjiuier city aud mr a.bar vail i an slant lu tli a latter tbefl.il la the chamber of the supreme court the latter a ti.a m mut clare depot when lbs circa t bo n psrfeil'sd profeesor mora seat to ilim l or t fx her usua e aud it corse wrai rats ools wbocoffi u a seat lu trip cats to too dut aa lruo language ol u.o instrument to lia itmore aad v us the first message ever traaaroilled by a recording telegraph a facsl.u ile of thai message with i'rolssaor morsr'b indorsement is here given the story of thl first mesiags has been nftjtn to v 1th nilmv r fi trf ral tn tt li t roamed about lurope wti'i vario rouiintiu material atutcbs l to i originating mai iiy u tbe krtocb imagination and bis s'arto l u aao from time to lime la oar own country under fresh forme but tbe above story is s uply and literally true au inventor in despair receives tbe news of his unmpected success from bis friend's daughter and bo mikes he a promise which be keeps uu 1 thus links hs name with his own and with au invention which becomes one of lbs control 03 mstru mtnta of civilisation for all t.mu s nzmr't monmyfar martk lit lswis ilaydeu of il uton lb colored member ofiere 1 a resolution ha.ooj a republ e in bpaiu and the speedy emaiulpu tloa of the nieck in cubs an 1 asks 1 its raiereaes to tbe comm.us0 on is srai relaucus it wee ordered though a lew members fo 1ins pkevh.te the noble yearning of mr hsyden a hearv bunseil once a siavu et templed to tnud it out u has 5 c puwe ti iteu iejpxlau atww b,"Based on the provided source text, there are no explicit descriptions of incidents of racial violence. The text mainly discusses the history and statistics of postal card usage in various countries, the legislative process regarding a particular bill, and a personal story related to the inventor of the telegraph. There is a brief mention of a resolution offered by Lewis Hayden, a colored member, advocating for a Republic in Spain and the emancipation of slaves in Cuba, but this doesn't describe an incident of racial violence itself. Here is the relevant quoted section:

""...Lewis Hayden of Boston, the colored member, offered a resolution favoring a Republic in Spain and the speedy emancipation of the slaves in Cuba, and asked for its reference to the Committee on Foreign Relations. It was ordered, though a few members feeling skeptically about the noble yearnings of Mr. Hayden's heart, himself once a slave, attempted to find it out."""
